short_descriptions,priority
p nun nokia authentication multiple login failures from the same source windows,MEDIUM
re pdd review continuation rtr manage business rules,MEDIUM
vpn issue getting a pop up error,LOW
user is getting access denied error message,MEDIUM
user account sibi r nsn id is not showing up on it service portal,MEDIUM
hosted virtual desktop applications issues,LOW
support portal i got single sign on error when trying to login to nokia support portal,LOW
it corner concierge,LOW
re question on credo user training status,MEDIUM
cvcs greece motion,CRITICAL
prescribers showing up under multiple territories,MEDIUM
patching issue partially result for,LOW
fnokia webex meeting center user did not receive the recording,MEDIUM
hardware wifi adaptor malfunction,LOW
wfh capability capacity monitoring metrics,MEDIUM
outlook display of hierarchy,LOW
talko package details api returns nulls for packages and,LOW
functional mailbox spoc africa list nokia com unable to receive mails,HIGH
it create ad account for,MEDIUM
pwc tool no policy scripts were loaded,LOW
please delete hanging volumes in the attachment,LOW
confluence account not valid,LOW
active directory and citrix,MEDIUM
please remove old and not actually requests to sap inbox from user artem lopin,MEDIUM
rp nsa unix request,LOW
profitability allocation special rules,MEDIUM
it corner concierge,LOW
functional mailbox unable to view new folders,LOW
user assignment implementation,LOW
p nun nokia application connectify detected on host symantec log source,MEDIUM
xml for trial closer,MEDIUM
eu is not able to install webex from software centre,LOW
ru microsoft project online professional request issue,LOW
it corner concierge,LOW
onboarding request for aditya patel,MEDIUM
re login problem to gitlab,LOW
unable to sign into skype,HIGH
checkout code from svn to is very very slow,LOW
fw access to t folder,MEDIUM
pl re add expired sap accesses,MEDIUM
hr block sender,MEDIUM
site rcps can t complete spec in site status approved,MEDIUM
myorders issues submitting orders,LOW
my sim card is dead need to activate a new sim card that i got,LOW
hardware battery faulty,LOW
software fmo webcam not working,LOW
p nun nokia multiple failed login attempts with privileged account,MEDIUM
it corner concierge,LOW
vpn remote access,MEDIUM
frances wei otsuka us com update email address,MEDIUM
user muhammad zeeshan riotinto com getting while try to access cares in secondary account,LOW
otss dl s ownership change,MEDIUM
it corner concierge,LOW
fnokia support portal unable to upload the sw,MEDIUM
rate inquiry role for lloyds george nokia com,LOW
pl block sender,MEDIUM
instances don t start,LOW
apac pfizer com cpqsminterfaceerror intel,HIGH
ec webex event center attendees did not received the webex event invite,LOW
ukraine urgent again adobe connection issue to not able to create pdfs for invoices,LOW
user cannot enter in the portal esat turgut vodafone com,LOW
not responding properly,LOW
jabber phone services not connected,LOW
it delete job in crm,MEDIUM
need access to nols team service,LOW
need an sftp client,MEDIUM
gq edms user access request new account request elkﾝn elif elifelkin otsuka us com,MEDIUM
please reboot server,MEDIUM
home directory not getting mounted when login to apac nsn net net it hangs,MEDIUM
shared drive access request,MEDIUM
kanani dilcher is not sample status ready,MEDIUM
de aled aled key registration request ron eduard schimanski nokia com,LOW
pfizer com logmonitor memory errors escalate and investigate issues asap unix syslog pfeunix memory errors linux,HIGH
pl reactivate users in ad,MEDIUM
ms teams training,MEDIUM
readsoft application issues,LOW
different email address shows up after logging in on sharepoint,LOW
there is no option for multiple profit c,LOW
usb dock hdmi usb vga erp push failed,LOW
hardware laptop does not charge,LOW
rs add user to shared mailbox,MEDIUM
comp portal is not working on new ipad not downloading apps,MEDIUM
software center software downloads would not progress,LOW
software center is stuck on downloading complete,LOW
bpp user time zones,LOW
ipad mouse cursor,MEDIUM
access to share drive,MEDIUM
unable to log in to the laptop,MEDIUM
unable to create the object link document batch sheet in production version,LOW
hardware fan causes heat or laptop is overheating battery faulty,LOW
software fmo laptop s keyboard keys not working properly,LOW
support portal sgk telenor dk mapping issue,LOW
office outlook not responding,LOW
doors do not work,HIGH
mec spool issues with newly implemented ppf in ng us,LOW
password reset help,MEDIUM
no internet connection when accessing nokia pages,MEDIUM
anyconnect other concerns,LOW
alliance cannot open creq,LOW
new code to ic mapping table,MEDIUM
approver access for project tube tool,LOW
reset password sap bpp,LOW
reactive unix account,LOW
bwp based sl report and feed to rm tool shows incorrect sales document reference,LOW
locks in sap,HIGH
athq define user group definiton missing,CRITICAL
pfizer com cpqfcahostcntlrstatuschange intel vm host,HIGH
not able to login to one drive on phone using nokia email id bhaskar das nokia com,LOW
access to jira,LOW
questions regarding veeva engage,MEDIUM
user request assistance laptop functionality issues,MEDIUM
create viewer and modify exsisting,MEDIUM
sample transactions report help,MEDIUM
demand moved to a new wbs g and svo,LOW
software fmo no remote desktop license on windows pc,LOW
unable to login bwp reference to,MEDIUM
add company e mail address,MEDIUM
ng error in account determination,CRITICAL
pc hardware laptop battery concerns,LOW
access to active directory groups,MEDIUM
active directory and citrix,MEDIUM
ae mailbox capacity issue,LOW
it corner concierge,LOW
hu gtt international line maintenance,MEDIUM
installation assistance request for westford ma service center,LOW
hardware laptop touchpad malfunction,LOW
hardware screen is damaged,MEDIUM
problem with patching ci investigation required,MEDIUM
outlook data file error,LOW
it corner concierge,LOW
issue in sap launch pad,MEDIUM
software center application list is empty,LOW
new ipad setup,MEDIUM
unable to connect to nokia network,MEDIUM
frdo blzaaw mgate cannot access hosts in x,MEDIUM
question about access to a sharepoint site,MEDIUM
orion fadm hcp shows as all s is orion,MEDIUM
it corner concierge,LOW
p nun nokia proactive recurrent reinfection,MEDIUM
empty software center after windows fresh install,LOW
ro unable to send email via mailrelay int nokia com as blocked by firewall,HIGH
not having access to the sw center,MEDIUM
application link between jiradc dr and confluence server is broken,MEDIUM
it corner concierge,LOW
p nun nokia proactive recurrent reinfection,MEDIUM
p nun nokia exploit multiple exploit types against single destination,MEDIUM
dn can not be planned,LOW
fr pc software download not progressing stuck at in software center for long time,LOW
license status invalid mohammad yousuf,MEDIUM
nct correction in test cases needed,LOW
access to cadency,MEDIUM
ct orion territory change please assign it to comm orion,MEDIUM
jabber other incorrect display name,LOW
request more details on ldap of dct server,LOW
akram rihan cw otsuka us com vv portal access,MEDIUM
hr viraj error found on macro download report in background,MEDIUM
error security database does have an account trust relationship,MEDIUM
cannot log into skype for business,MEDIUM
fw poor connectivity from nesc cloud in bangalore to ldap server,LOW
ie employee assigned to position not visbile in ireland structure,CRITICAL
p nun nokia proactive recurrent reinfection,MEDIUM
hardware laptop wont turn on,LOW
ms teams training,MEDIUM
hosted virtual desktop cannot launch or start hvd,LOW
tmo bellevue lab connection problem from espoo,LOW
the present state of the incident is request implemented please set this state to resolve,LOW
jabber sso cannot sign in,MEDIUM
pfizer com logmonitor veritas vcs rac failure escalate and investigate issues asap unix syslog pfeunix veritas vcs rac errors solaris zone,HIGH
bios password enabling hyper v assistance,LOW
it corner concierge,LOW
bso deleted user,MEDIUM
ru pc sound not working on pc,LOW
scheduling of otm invalid location report for octavio reyes nokia com,LOW
ccr monitoring pr not in,LOW
it corner concierge,LOW
rp nsa unix request,LOW
unable to open share point page in elearn from citrix,MEDIUM
listserv listserv ownership inquiry,LOW
alfa fpr rates issue,LOW
otm access for larissa vandeven dbschenker com,LOW
it corner concierge,LOW
it corner concierge,LOW
outlook ms office error not able to open,LOW
mdm tool not working,MEDIUM
it corner concierge,LOW
hardware fan error,LOW
elearn on ipad,MEDIUM
reset domain password,MEDIUM
p nun nokia single infection single host virus clean failed symantec,MEDIUM
fnokia server request to run attached script,LOW
“current owner” field takes almost a minute to fill in automatically,LOW
re approval request master list,MEDIUM
company portal help,LOW
sap incident process chain failures group,LOW
gr change role in spc system,MEDIUM
hardware fan noise,LOW
registration of my desk phone doesn t work,MEDIUM
dme allocation reload croatia bosnia herzegovina and slovenia,CRITICAL
we have received multiple host down alert on porto salvo please check and update us any palanned outage or other activity going on site,HIGH
webex plugin is missing,LOW
mv j hera eept data oi is not updated,LOW
i buy access problem,LOW
change of mileage rates for republic of ireland,MEDIUM
emea pfizer com down intel,HIGH
program details project details and opp details not updated after project reset and add scope,LOW
remove level local group for category for all russian locations,MEDIUM
software fmo booting problems after pressing,LOW
it corner concierge,LOW
assistance with uploading documents into folders,LOW
jabber unable to make calls,LOW
new sac user,CRITICAL
it assign roles,CRITICAL
cambridge uk planned site outage,LOW
the user is calling stating that they need an active directory account unlock,MEDIUM
user dkakadia google com getting sso login error,LOW
sharepoint site pending request after hours,LOW
please assign access,MEDIUM
la data for us mostly eur suppliers listed,LOW
unable to access veeva mobile app on ipad,MEDIUM
sn ms office unable to uninstall,LOW
problem with log in to support portal,LOW
hu sap q system access,CRITICAL
fnokia mailbox unable to access email,LOW
prm user not found on nam,MEDIUM
ee jiradc unable to access,LOW
p nun nokia multiple infections single host clean failed,MEDIUM
p nun nokia port not block from internet on fortigate dkaalab,MEDIUM
it corner concierge,LOW
reset citrix account,MEDIUM
it corner concierge,LOW
rs user locked in bw system,CRITICAL
laptop request for rondessa collins,MEDIUM
pfizer com devcapacity monitor disk utilization for var share exceeds devcapacity guest ldom,MEDIUM
pfizer com cpqheflttolpowersupply linux,HIGH
i am not able to login with my global account credentials,MEDIUM
vpn remote access,MEDIUM
coin capex online integrated management,MEDIUM
it corner concierge,LOW
it update table zfi lease lifnr,CRITICAL
nosi is slow,LOW
ssh connection can t be established from virtual desktop to any server,MEDIUM
kenneth springfield s phone message,MEDIUM
re hvd login issue,LOW
hardware hard disk error,LOW
it corner concierge,LOW
elearning pin reset,MEDIUM
problem in launching courses trainings,MEDIUM
rs roles for,MEDIUM
unable to log into skype getting error invalid credentials,MEDIUM
subgroup i mn bb ps po disappeared from i jira fusion bb fca ku in nims tool and can t be added back,MEDIUM
pl employee sales orders,MEDIUM
repo at securitymanager is not reachable,MEDIUM
unable to download invoices,HIGH
jabber input keyword here exact description of the issue,LOW
kam approval bpm,MEDIUM
address list for insights to be updated,MEDIUM
is completing frequently not processing the queue items,MEDIUM
hardware laptop hard disk malfunction,LOW
office external database driver error excel access,LOW
hardware camera not detected,LOW
it corner concierge,LOW
elearn on ipad saml,MEDIUM
p nun nokia proactive recurrent infection clean failed symantec,MEDIUM
vpn issue for externals high severity as users are impacted,LOW
access permission request to confluence site,LOW
ch pls create workcenter for plant costa project,MEDIUM
unable to access vpc,LOW
user cgarrido insyteinstalaciones es facing an sso error in support portal,LOW
delete customer user oscar borja,LOW
sap incident process chain failures bwr group,LOW
unable to view documents that ends with fni,LOW
pfizer com cpqfcahostcntlrstatuschange intel vm host,LOW
user wesley bywater three co uk getting error sso – user can not be created,LOW
amer pfizer com cpqclusternode intel,HIGH
restore shared file of employee that left,MEDIUM
network unable to access ssh browse vlab vm from office laptop,LOW
mail comes from clearquest app failed to send to third party mailbox,LOW
user locked out of his account unable to login to skype for business,MEDIUM
it corner concierge,LOW
idoc error from party movement,MEDIUM
problems with installing software windows update,LOW
us unable to access sharepoint online page,LOW
account locked out,MEDIUM
jabber cannot sign in or cannot open page try again later,LOW
need sftp access for user alpim extracts and frng alpim extracts domin,MEDIUM
recover missing email saved in draft,LOW
exceptional t codes access,MEDIUM
statement delete serbia inrsd,CRITICAL
unable to log in to cronos inside support portal,LOW
ndpe speed issue,LOW
software fmo windows license expiration notice,MEDIUM
user hanekofp telkom co za facing issue in accessing cares tickets hangs at “loading” of fields,LOW
it corner concierge,LOW
elearn verification failure,MEDIUM
access to remote desktop connection for bsr,MEDIUM
vpn remote access,MEDIUM
need to get the technical details for the t code,LOW
in unable to launch app after vpc login,MEDIUM
it e mail threat subject promemoria per processo,MEDIUM
jabber phone services not connected issue,LOW
it corner concierge,LOW
please repeat for all instances of rtm marcoussis etc,MEDIUM
provide access to ftp server,CRITICAL
surajpal singh cw otsuka us com unable to open word document from sp,MEDIUM
hu sap globallly locked,MEDIUM
ct orion data issue please assign it to comm orion,MEDIUM
pl helo duplicated profile,MEDIUM
jabber phone services phone services not connected,LOW
the issue has been occurring for the past days during the us daytime ist to about ist we suspect this issue may re occur again today,LOW
it corner concierge,LOW
inquiry local virtual machine other issues,LOW
laptop not able to connect to any network,LOW
contact add trainable field in icc,LOW
support portal aio intego dk active accounts,LOW
cz acces to disc for rene stuchlik,MEDIUM
hardware fan issue,LOW
bso change e mail,MEDIUM
ie sr for ms audio,CRITICAL
intune company access setup is incomplete on mobile,LOW
srm problem important,LOW
star phone not working ip s n port tower a first floor musca mr,LOW
the mentioned user account aleksandar nikolic needs to be corrected in sp backend,LOW
check the mentioned server connectivity,HIGH
jabber phone unable to place receive phone calls,LOW
ru izhevsk configure backup,MEDIUM
it corner concierge,LOW
ch unlock airwatch account,CRITICAL
nsn network support hp wlan incident in nosi connection issue,HIGH
installing application stuck at,MEDIUM
cannot connect using vpn remote access,MEDIUM
bpp to nbl file interface issue,LOW
urgent help required hvd issues,LOW
pl sales order roles,MEDIUM
hp printing printer login and scanning documents,LOW
system wrongly sum up cbl wbs g,MEDIUM
gr vpn the vpn connection failed due to unsuccessful domain name resolution,LOW
user noc angolacables co ao getting error – repeating password issue,LOW
pfizer com logmonitor memory errors escalate and investigate issues asap unix syslog pfeunix memory errors linux,HIGH
workstation laptop performance,LOW
assign to sales data steward merge golden gate pharmacy accounts,MEDIUM
addquote update flow timing out between crm and eai,MEDIUM
office application error,MEDIUM
jira issues earch performance problem,MEDIUM
unable to connect to nosi,LOW
patching issue partially result for,LOW
unable to connect via cisco vpn,LOW
it corner concierge,LOW
it corner concierge,LOW
lcdm agent is loosing data to update,HIGH
es ms edge unable to open pdf files,LOW
webex webex meeting is missing in outlook ribbon bar,LOW
unable to connect to citrix from ey,HIGH
pl change shared mailbox owner,MEDIUM
my computer workstation,LOW
ch creation of storage bins,MEDIUM
ad account locked out,MEDIUM
it corner concierge,LOW
print attachment from iphone,MEDIUM
please unblock the user in system,MEDIUM
no software is automatically downloaded and installed on laptop,LOW
it corner concierge,LOW
elearn pin reset,MEDIUM
re release of the forecast dp to snp for version re,MEDIUM
it issues with,MEDIUM
pc termination request user status obsolete in nims,LOW
p nun nokia multiple failed login attempts with existing privileged account,HIGH
user joao godinho parceiros nos pt getting error –repeating password issue,LOW
skype issue can not sign in,MEDIUM
modern intranet unable to access https nokia sharepoint com sites nokia central,LOW
ru cares access to care portal former nols,LOW
unable to install update,LOW
create me test user in,MEDIUM
leave update issue,LOW
gr online archiving,MEDIUM
removing a module does not establish the right timeline not even manually,MEDIUM
can t login through isource portal,MEDIUM
inconsistency between apo and ecc,MEDIUM
oss connection to,MEDIUM
can t go to nokia s hosted virtual desktop,LOW
software fmo installation,LOW
ng remove user obinna humphrey ndokwu from idm notifications,MEDIUM
gr removal of shipment from tour monitor,CRITICAL
mass upload for,LOW
cz stmi card replacement,MEDIUM
update bss greece,MEDIUM
cz and as reject free of charge,CRITICAL
can you please tell the ip range for my location,LOW
update the macro version apassos,LOW
unable to delete stack,LOW
docker configuration folder on,LOW
software center update downlaod always display status complete,MEDIUM
unlock user and change password,CRITICAL
it corner concierge,LOW
hcp joan griffin can not be added,MEDIUM
re unable to access elearn,MEDIUM
ch create nam kam role in,CRITICAL
help to add below team into team for jiradc,LOW
hu shared mailbox e mail forward,MEDIUM
issues while connecting to datasource in powerbi,MEDIUM
fi ee jira due to building redundancy a new server has been build up and one additional ip number must be added to the user name connecting to the mirrordb,MEDIUM
check od sending status in bpp,LOW
can t connect to salesforce,MEDIUM
it corner concierge,LOW
oss connection related to oss message system,MEDIUM
software center removal failed uninstallation error for anyconnect,LOW
it corner concierge,LOW
mass changes for ru users sap hr clean up,MEDIUM
mailbox unable to send receive emails,LOW
it corner concierge,LOW
powers cord request,MEDIUM
hu ad hoc data refresh for hungary,MEDIUM
software not received,LOW
dp issue failures for amer bs ct,HIGH
bpc access for,MEDIUM
hardware faulty keyboard,LOW
bh dc os ohn account trsdci,LOW
ssh keys to gerrit slaves,LOW
cdb contract deu f c file not sent,LOW
user added a bunch of account office staff affiliated with hcp s and they dropped out of her accounts,MEDIUM
bmc remedy password to action request system does not work,LOW
gq edms user access request new account request sheryhan elrifaey,MEDIUM
canon employee deactivation,MEDIUM
it convert ufficio fiscale cchellenic com in shared mailbox,MEDIUM
qtc sales order – create do,LOW
ch unlock airwatch,MEDIUM
vpn remote access certificate validation failure using mfa,MEDIUM
ch airwatch account for abate yimam,MEDIUM
it reactivate user,CRITICAL
domino password synchronization request,LOW
gwc kanata wde outage,HIGH
user mortenso wapa gov getting sso error,LOW
itpol project access edit permissions issue,LOW
rp nsa unix request,LOW
audio is not working in laptop,MEDIUM
hospira corp down intel vm guest,LOW
hr wbs not activated ref,CRITICAL
in otm production to delete the mentioned deliveries and re trigger the same,MEDIUM
user sascha just kunrath dimensiondata com getting error – repeating password issue,LOW
display date time is incorrect on all ip desk phones in taipei cec service provider crosspoint,LOW
jabber phone services issue,LOW
windows how to reinstall windows pc with onsite support,LOW
functional mailbox not able to login faultmanagement tm us nokia com,MEDIUM
problem with access to files cshrc personal and bashrc personal in my unix account,LOW
hu block email address,MEDIUM
windows high cpu usage,LOW
january — os build,LOW
software fmo unable to install nokia image unable to load boot menu,MEDIUM
hardware touchpad not functioning,LOW
pfizer com cpqdadrvstatuschange intel,HIGH
virtual pc grayed blank screen,LOW
report queue item not processed by robot,MEDIUM
re laptop setup,MEDIUM
unable to open interaction client,MEDIUM
bi report le version is,MEDIUM
returnf from lal deletion,MEDIUM
add user to ad groups,MEDIUM
exports not being received,LOW
forecast import template doesn t copy al,MEDIUM
db lock issue,MEDIUM
pl user globaly locked,MEDIUM
pfizer com cpqnic intel vm host,HIGH
please send a new certificate to user,CRITICAL
cz tlb order delete,MEDIUM
singlecrm salesforce support ticket for hcl team,MEDIUM
p nun nokia proactive recurrent reinfection,MEDIUM
fi unable to access hvd,LOW
user mark henderson cox com getting error sso – user contact already has a relationship,LOW
it corner concierge,LOW
cso line cannot be completed due to plant error message,LOW
change snow business approvers,CRITICAL
trouble with laptop,LOW
jabber phone services invalid credentials for phone service,LOW
assign the right license to the users and,MEDIUM
p nun nokia authentication repeat windows login failures,MEDIUM
it corner concierge,LOW
p nun nokia http upload suspicious data size,MEDIUM
ad us pri wyeth com down unix,HIGH
telephone conferencing for office,MEDIUM
ie re assign lost access,CRITICAL
software fmo unable to install printer eventhough the user has a local admin right,LOW
memory physical overutilized intel,HIGH
kf actuals to be copied,MEDIUM
sap pwo password reset,LOW
otsuka sp site training file access,MEDIUM
my computer workstation enable virtualization on bios,MEDIUM
pcir to libra interface issue,LOW
unable to access cares,LOW
vpn remote access,MEDIUM
subject urgent pls create ticket to alliance team for restoration of archived pos,LOW
user steinar moe oneco no getting error sso parent account id not identified,LOW
unable to login to an external website xfinity,LOW
hu bw report,MEDIUM
inquiry about prepping laptop for return,MEDIUM
functional mailbox request was completed but not applied,LOW
workstation request for onsite assistance to install ram,LOW
it corner concierge,LOW
i am finding outlook issue,LOW
jabber sso cannot sign in or cannot open page try again later,LOW
webex meetings desktop app starts after each meeting even that settings is disabled,MEDIUM
mc webex unable to log in error user account has been deactivated,LOW
cisco anyconnect no option to select gateway shows automatic selection and grayed out,LOW
unable to log in with the cip password,LOW
hvd access problem,LOW
jabber phone services phone services doesnt function again,LOW
re added hcp treatnow cert question,MEDIUM
it corner concierge,LOW
nokia ff support command center wos for,LOW
host process changed requests access,LOW
hu transfer from to hcp,CRITICAL
video room conf blue jeans with polycom and ext,MEDIUM
ro ssf request cancellation,MEDIUM
requesting to change user email id,LOW
pt sap bpp login issue,MEDIUM
delete order number,MEDIUM
open security options greyed out in nokia sap,LOW
jabber phone services not available,LOW
nokiameetings site is not enabled for use with microsoft office,LOW
p nun nokia agent service shutdown timeout exceeded carbon,MEDIUM
user ibrahim darisleem t mobile com unable to access the helpdesk,LOW
change description for tax code iz,LOW
pc is not charging,LOW
office outlook not responding email mobile email,LOW
re optum claims cdm files otsuka ses,MEDIUM
jabber phone services mobile phone services not connected,LOW
pl access to q environment,MEDIUM
it corner concierge,LOW
unapplied eleaves captured in the myerm tool,LOW
re system issue,LOW
id request for pc reuse,LOW
machine issue when docked to the docking station,LOW
server is unavailable,MEDIUM
homes is almost full of marcaussis region need to extend,LOW
sw downloading takes too long time from finland to nj lab,LOW
pfizer com logmonitor unix linux networking errors escalate and investigate issues asap unix syslog pfeunix networking errors linux,HIGH
request for ceme table update add asset type to commodity code for german entities,LOW
it corner concierge,LOW
it corner concierge,LOW
software center not working,LOW
user kharitonov ev ural rt ru getting sso error,LOW
delete from shipment id,LOW
bydgoszcz frankfurt sih link was flapping and currently down,HIGH
active directory and citrix,MEDIUM
supplier not found in i buy,LOW
apac pfizer com cpqsmselftesterror intel,HIGH
fi intune getting error device limit reached need assistance to clear older device,LOW
error when loading cny fx rates into sap,MEDIUM
it corner concierge,LOW
hardware audio devices are not working properly,LOW
support portal cibicom services a s user mapped wrongly,LOW
service now modify request cr dema problem sr incident,LOW
qipp access to be enabled again,LOW
sslad vdom change belgrade fortigate,MEDIUM
user account is locked,MEDIUM
party partner to access vm on nokia nesc cloud,LOW
request to become member of the swbuild group in ultima,LOW
support portal xavier hinfray orange com account issue,LOW
it corner concierge,LOW
dp issue failures for amer bs gp ct alliance dev no backup,HIGH
fnokia mcg capex sync sapim and workflow tool,LOW
proxy script stopped working,HIGH
active directory and citrix,MEDIUM
srm issue extreme latency,MEDIUM
