short_descriptions,priority
ir issue cas,LOW
anyconnect certificate validation failure error,LOW
rest sap e box qtc password system,MEDIUM
p nun nokia ssl exploit detect from host,MEDIUM
my sap account has been de activated due long time not loged in,LOW
hr eleave global paid vacations shouldn t be available for trainees colombia,MEDIUM
gr copy accesses from to,CRITICAL
not able to log on,MEDIUM
it corner concierge,LOW
scan from ipad,MEDIUM
snmpagent apac pfizer com notresponding intel,LOW
locked out of credo,MEDIUM
de simago unable to access simago page,LOW
change owner of a colaboration space,MEDIUM
request incorrect incomplete fulfillment of service request,LOW
exchange two user,CRITICAL
remove business role,CRITICAL
nokiameetings webex meeting page is blank,LOW
it corner concierge,LOW
re priority has been assigned to you gq edms user access request permission change request shim juyoun,MEDIUM
it corner concierge,LOW
change of entry date petr ljapin,MEDIUM
modify excluded from distribution,CRITICAL
software fmo pxe error,MEDIUM
pc hardware keyboard concerns,LOW
request incomplete fulfillment of service request,LOW
rest api of pronto tool provides incorrect data sdl pronto power bi view inconsitent,HIGH
please join pre dr meeting for global lims pgs production application on aug am edt am edt,LOW
cisco anyconnect stopped working,LOW
no access to internal job market,LOW
hardware battery faulty,LOW
change request for expected exit date,LOW
ndp execute opportunity missing,MEDIUM
ru edi please setup new message recadv for partner holiday,MEDIUM
jabber phone services cant make calls,LOW
user is unable to access url ext net nokia com,LOW
can t connect cloud instance from network,LOW
requester role required,LOW
need a daily failure report from ipaas related to ndpd or siteforge flow,MEDIUM
amer pfizer com cpqheflttolfan intel,LOW
myhrportal one time payment information,LOW
it corner concierge,LOW
desadv idoc not received to for shipment,MEDIUM
mac unable to work in oulu factory,MEDIUM
organizational mapping missing,LOW
access to zr ftd oos,MEDIUM
de server no backup on,LOW
hvd unable to connect,LOW
attention cchellenic server request nwuqk,CRITICAL
office bit issue,LOW
my landline is giving an error message,MEDIUM
p nun nokia exploit multiple exploit types against single destination,MEDIUM
process chain failures bwr group,LOW
ro cms make barcodes visible in archive,MEDIUM
hcp can not be sampled,MEDIUM
sign into skyp,MEDIUM
unable to login to restricted confluence page,LOW
fnokia case handling unable to close the case,LOW
use veeva vault in another browser,MEDIUM
it corner concierge,LOW
filipe fernandes nid day blocked in tr as absence,LOW
ct red team training orion showing blue team instead of read team please assign it to comm orion,MEDIUM
ch delete technical users in idm,MEDIUM
nokia core programs cisco jabber and microsoft office are missing on software center,LOW
unable to access to share drive,LOW
p nun nokia single infection single host virus clean failed symantec,MEDIUM
hardware battery need replacement,LOW
customer account for martin rickards sky uk,LOW
software fmo windows update is failing,LOW
amer pfizer com cpqclusternetwork intel,HIGH
whitelist and org ua,CRITICAL
jabber other audio settings keeps on changing to intel display audio,LOW
resorce not visisble to ra for allocation,LOW
we experienced a repeatly windows pop up on our sunnyvale linux server at,LOW
sharepoint team site request approval,LOW
gr password reset and unlock,CRITICAL
in sharepoint add logo to group site,LOW
bell mobility inc po received on showing dummy order,MEDIUM
rp nsa unix request,LOW
item sent from alpim but have not arrived in enovia,MEDIUM
software fmo bsod,MEDIUM
hardware laptop fan always on when plugged in,LOW
digital people management,MEDIUM
emea pfizer com cpqclusternode intel,LOW
travel expense entry not visible to line manager to addd travel cost,LOW
mailbox client issue disconnected,LOW
elearn login on new ipad,MEDIUM
hvd is not working,LOW
jabber phone service phone service issue,LOW
software center software installation or un installation issues,LOW
activate pwa project online,LOW
request incomplete fulfillment of service request,LOW
request incomplete fulfillment of service request,LOW
ibp s op,MEDIUM
user emma ruby kleenit com au case id has rejected by ebus synchronization,LOW
it corner concierge,LOW
unable to launch virtual pc india,MEDIUM
in it portal unable to view,LOW
p nun nokia source trying to visit malicious domain,MEDIUM
office activation issue office not activated,LOW
orion access on laptop,MEDIUM
hosted virtual pc does not start anymore,LOW
mesa scheduling client tool password reset,LOW
vpn remote access unable to access several intranet sites,LOW
bitlocker unable to set pin after using recovery key,LOW
computer not found in snow n,LOW
unable to successfully reach https directory int net nokia com over vgp global us chicago,MEDIUM
software center is not working properly,LOW
nl cti system reconfiguration,MEDIUM
change business approvers,CRITICAL
set product name to isam ont in tickets listed,MEDIUM
sap issue invoice creation,LOW
p nun nokia exploit multiple exploit types against single destination,MEDIUM
citrix issue issue logging in to citrix as system assumes that user needs to have rsa,LOW
ng office license upgrade,MEDIUM
nokia hybrid cloud application issues,LOW
fnokia windows unable to install os after booting via pxe not responding,LOW
lost access to s drive,MEDIUM
functional mailbox add delete access rights,LOW
follow up needed for em exception smarts cmdb discovery error snmp agent does not respon and not pingable,MEDIUM
the user is calling stating that they need an active directory account unlock,MEDIUM
it bpm derivation table replate input field,MEDIUM
gdc issue delay transfer of data in zambia eniq,HIGH
it corner concierge,LOW
otsuka vine contractor access,MEDIUM
it corner concierge,LOW
it corner concierge,LOW
the user is calling stating that they need their active directory account enabled,MEDIUM
in support portal cannot login nols,LOW
please include employees in the group s mailing list g cchbc co bso cchellenic com,MEDIUM
not able to jump on server,HIGH
it corner concierge,LOW
user thierry kennes onati pf unable to access the products in support portal,LOW
bi rem phase forward requirements re,MEDIUM
registro informação complementar dos documentos fiscais quando das prestações interestaduais d,LOW
issue oss webcam issue,LOW
co sap bpp field services cost centers,LOW
ru ar cchellenic com,MEDIUM
opdc clinical report publishing mailbox access,MEDIUM
it corner concierge,LOW
hosted virtual desktop applications issues,LOW
dp issue failure for,HIGH
new account still not visible under secondary account menu belongs to case id,LOW
mobile stp qty need to move from main missing site to,LOW
jabber other receiving repeated various calls from tanzania,LOW
pl assign access,MEDIUM
cleartool error while executing ct cmds,LOW
eflow launch access denied on system,MEDIUM
certificate validation failure,LOW
orion nys doccs orion removal request,MEDIUM
filesystem c overutilized intel,MEDIUM
nokia ff support blocked wo s,LOW
p nun nokia exploit multiple exploit types against single destination,MEDIUM
poland service request priority esn order creation ordering urgent,HIGH
hvd not opening for user,LOW
pl talent profiles access,MEDIUM
p nun nokia single infection single host virus clean failed symantec,MEDIUM
new ssh key is not applied in gerrit int net nokia com,LOW
sharepoint missing file,LOW
machine does not respond,LOW
p nun nokia x force premium internal connection to host categorized as malware event type,MEDIUM
cisco vpn not working,LOW
users cannot access sharepoint site page already read access to all nokia is provided,LOW
directory and file permissions,LOW
jabber phone services unable to make a call,LOW
au sharepoint online request to create new page or upload contents on sharepoint,LOW
accessing incorrect hvd,LOW
my support portal profile info are out of date,LOW
this is a bypass ticket please send directly,LOW
need help to map my p drive,MEDIUM
stop auto posting armavista,MEDIUM
sap logistics yposper with no results for luciana bode,LOW
kronos unable to open,LOW
enh route determination missing,LOW
user facing issue with global policy for safter collection training,MEDIUM
it corner concierge,LOW
sp access needed,MEDIUM
health cloud access help,MEDIUM
user chandra mistry bt com need to associate in cares,LOW
gateway list is missing,LOW
vpn unable to connect after migrating to windows,LOW
uk replication of several stps from sap to cover,LOW
snmpagent pfizer com notresponding intel,LOW
it corner concierge,LOW
in vpn certificate validation failure,LOW
vpn remote access,MEDIUM
hp printing unable to login out of order error,HIGH
p nun nokia exploit multiple exploit types against single destination,MEDIUM
unable to access website via site to site connection,LOW
sudheer kammili cw otsuka us com sudheer kammili cw otsuka us com wants to access caseprocessing,MEDIUM
it corner concierge,LOW
default ipad pass code for ipad,MEDIUM
plsd please assign permission send as and editor to mailbox leadership conference warsaw cchellenic com,CRITICAL
cannot access share nsn intra net eefs espoo ipr,HIGH
virtual pc unable to connect to poland virtual desktop server,MEDIUM
security updated got stuck in software center,LOW
oss user and connection open for,MEDIUM
dp issue backup failure for,HIGH
unable to connecto to nokia vpn with anyconnect,LOW
franklin park data center not accessible,CRITICAL
workstation onsite support wireless card software does not run,LOW
can not add rooms into,MEDIUM
vpn to access to intranet,MEDIUM
ch delete barcodes contracts from cms,MEDIUM
ir report not generated for today,HIGH
please reset password,MEDIUM
our functional account jaadojen can t login after migration,HIGH
amer pfizer com cpqclusterresource intel,HIGH
it corner concierge,LOW
knipper paper request issue with hcp s,MEDIUM
spc quality monitoring,MEDIUM
it corner concierge,LOW
autosys ams non prod read write access revoked,LOW
eura the vpn connection failed due to unsuccessful domain name resolution,LOW
it corner concierge,LOW
it corner concierge,LOW
it corner concierge,LOW
priya gupta cw otsuka us com request for cro integration access,MEDIUM
user need a new sap password,MEDIUM
amy noon otsuka us com fw otsuka connect updates,MEDIUM
oriom security model by product,MEDIUM
cisco anyconnect slow connection,LOW
vpn remote access,LOW
deletion of form,LOW
p nun nokia recon local dns scanner,MEDIUM
my computer workstation my pc keeps crashing wiht blue screen of death,LOW
jabber phone services softphone services not work,LOW
request incomplete fulfillment of service request,LOW
git failed to authenticate,MEDIUM
software fmo cant finish windows upgrade,MEDIUM
zsrs request with updated survey,MEDIUM
pfizer com process the vxrelocd process has stopped escalate asap unix,LOW
hr viraj rpa error found on macro master all output creation unable to create the dq error file,MEDIUM
ireland offices closed,MEDIUM
docking station not responding,MEDIUM
fnokia cisco anyconnect certificate validation failure,LOW
update email d list,MEDIUM
application ee linsee unable to login,LOW
robot scripts can t connect to webem machine,MEDIUM
create dhcp reservations,CRITICAL
software center faq how can i find a software package that i had in falu environment,LOW
leave request error in eleave tool,LOW
import to q,MEDIUM
tax decision maker world,LOW
update hb decision table ro,MEDIUM
svo available in the tool,LOW
it corner concierge,LOW
no network on wlan and lan,MEDIUM
fw albertson s distribution question data investigation,MEDIUM
re itpol deployment,LOW
mfa correlation id,LOW
p nun bme new lab detected,MEDIUM
webex event center not able to login webex event,LOW
it corner concierge,LOW
office outlook when creating schedule meeting user unable to see the calendar s schedules,MEDIUM
please re discovery the ci and update us,LOW
support ticket number,LOW
retrieve talent data for andrijana vukovic,MEDIUM
network account locked out unable to login,MEDIUM
p nun nokia proactive recurrent infection clean failed symantec,MEDIUM
unable to open virtual pc,MEDIUM
bt access to q system,CRITICAL
dp issue failures for amer bs gp ct,HIGH
move to next approver,LOW
software fmo unable to connect to lan connected but no internet,LOW
my computer workstation,LOW
office outlook unable to open outlook,MEDIUM
p nun nokia x force premium internal host communication with malware url,MEDIUM
vendor not visible although extended for i buy,LOW
virtual call center vcc call quality is bad,LOW
assign of position,CRITICAL
fw adobe acrobat pro dc,MEDIUM
pfizer com logmonitor unix linux networking errors escalate and investigate issues asap unix syslog pfeunix networking errors linux,HIGH
it corner concierge,LOW
it corner concierge,LOW
moscow plantvisit cchellenic com,MEDIUM
nokia ff support cancellation of po´s,LOW
ad assign access,CRITICAL
it corner concierge,LOW
cz blocked sender cchellenic server cid dart werbung de,MEDIUM
loss of intranet access from work sites after logging into support account for usa aventail site,LOW
unable to access outlook follow up,MEDIUM
recall service request task has been assigned to shubhankar kumar cw,MEDIUM
in continuation to ticket,MEDIUM
please help us investigate why the user jennifer ogrady nokia com csl jeogrady doesn t have the confiramtion nor confirmations for team carts tabs on her,LOW
follow me printer registering new badge,LOW
keeps getting locked out of laptop,MEDIUM
ccr monitoring double source in,LOW
jabber chat jessica palafox nokia com appears as my name when sending a message to my colleagues,LOW
office excel performance issue not able to extract data for with wbs,LOW
asap exclude user from idm replication,CRITICAL
enh all uk technical users sap dms document workflow owners,LOW
dp issue failures for emea bs gp ct,HIGH
it corner concierge,LOW
netwrix auditor inactive users in active directory report mocr otsuka com,MEDIUM
sap run time error massage while processing fluping,LOW
pfizer com down solaris zone,LOW
p nun nokia application connectify detected on host symantec log source,MEDIUM
cisco anyconnect connection fault,MEDIUM
ourtalent access denied,LOW
lawson psa delete access request,LOW
it corner concierge,LOW
break fix emea pfizer com cpqdaaccel intel,HIGH
jabber other messages are not sent and getting failed with error,LOW
jabber phone services issue with jabber phone services not connected,LOW
qa nols not operating,LOW
software fmo system tray not resizing,LOW
accessible powerbi tool but data not available,LOW
support portal mailbox getting locked,HIGH
all users company wrongly mapped in sales force need to correct it as nam swan a s,LOW
access request to colleague s calendar,LOW
process chain failure,LOW
oneclickmeeting occupancy status of cec meeting room taipei taiwan,LOW
zachary baudoin cw otsuka us com fw request for add edit permission,MEDIUM
unable to connect to vpn,LOW
investigate if mdm works and why the attached files failed to be transferred to atlas,LOW
hr add user to ctry ba pdt,MEDIUM
created cni disappears,LOW
hvd connection issue,LOW
last log on information,CRITICAL
cares account reactivation request,LOW
pl changing operating days hours for the csc lines,MEDIUM
nokiameetings sreen sharing lateness,HIGH
jabber spam calls,LOW
unable to skype meeting in outlook,MEDIUM
cares user michael verizonwireless com unable to access cares,LOW
amer pfizer com down intel,HIGH
mk add new vendor in planon,CRITICAL
https ext net nokia com unable to log in,LOW
bso add user to country approvers team,MEDIUM
re please fill the survey for the incident,MEDIUM
remove entry with annual leave wrongly chose retraction,LOW
cares remedy arerr authentication failed,MEDIUM
user doesn t have write access to svn,LOW
smtp intermittent issue in mailrelay int nokia com,MEDIUM
windows keeps on changing focus when typing,MEDIUM
user georgios porfyris telia no getting error – repeating password issue,LOW
cannot start my hvd windows persistent europe,LOW
grant user permission to na display services,LOW
orders where specs completed but the status in mesa does not show complt,LOW
please update name in ad from all uppercase mathangi ashok to mixed case mathangi ashok,MEDIUM
support portal nols application issues,LOW
unable to login to support portal,LOW
nokiameetings mc nokiameetings unable to setup webex meeting invite via outlook,LOW
dp issue bs gp ct,HIGH
please create new ticket very slow file system on server emea nsn net net,LOW
account unlock request,MEDIUM
cz cti user based on,CRITICAL
amer pfizer com down intel vm guest,HIGH
jabber phone services jabber phone services disconnected,LOW
request completed but still not available,LOW
pl cti lines close,MEDIUM
senegal document is incomplete billing can t be carried out sales document type mismatch,LOW
sap statistics server alert,MEDIUM
access to ftp server,MEDIUM
unable to install application on software center,LOW
it corner concierge,LOW
users account is locked,MEDIUM
computer unable to boot into log in screen,MEDIUM
issue with connecting to otsuka guest and emailing photos from cellular phone to business email address,MEDIUM
ch altibox user issue,LOW
webex meeting center unable to set meeting,LOW
unable to open images in sap,LOW
unable to install application in software center,MEDIUM
please create online arhive for users mailbox anastasiya maksimenko cchellenic com,MEDIUM
international movement inside cch termination,MEDIUM
catherine weiss otsuka us com change to a sharepoint page,MEDIUM
printer compatibility question for new ipad,MEDIUM
dp issue failures for amer bs gp ct,HIGH
nokiameetings pre post meeting experienced issues enter site url,LOW
it corner concierge,LOW
gr enable smtp authentication,MEDIUM
software fmo es windows windows error,LOW
mouse on ipad,MEDIUM
mbq server is down,LOW
send to ariba network failed permanently for po,LOW
pfizer com increased severity as incident repeated times the asset can no longer be reached ops center pfe oem ops center alert guest ldom,HIGH
trackwise running application,MEDIUM
it user copy and in,MEDIUM
please create new distribution group lc td russia lc td russia cchellenic com,MEDIUM
it corner concierge,LOW
mfa request correction,MEDIUM
user mahmoud osman ogero gov lb unable to download nfm p software,LOW
user request assistance unable to access bomgar,MEDIUM
pl windows not starting,MEDIUM
it corner concierge,LOW
network drive unable to connect,MEDIUM
failed to download file from linsee server with common account,LOW
user andrew cameron centurylink com account need to be corrected in sp back end,LOW
jabber phone services unable to make calls previous ticket,MEDIUM
tpst robo sends emails with wrong email headers to camunda,MEDIUM
unable to access hvd,LOW
not able to access server hospira corp,MEDIUM
laptop pc display issue,LOW
sharepoint web part problem,LOW
living well at otsuka access,MEDIUM
it corner concierge,LOW
ndpd bi report not generated,LOW
emea pfizer com down intel,LOW
issues with old ipad,MEDIUM
pl feedback issue on receiving calls oobh and to personal number,LOW
jabber mobile unable to call numbers wth indian country code unable to change phone settings,LOW
bg user requested assistance with unlocking her ad account,MEDIUM
support portal error,LOW
ticket closed missing system selection in sso drop down hi,MEDIUM
bitlocker bitlocker recovery key request,LOW
it corner concierge,LOW
unable to access jabber failed to start a new session,LOW
trouble with laptop,LOW
laptop reimaging request,LOW
hfm report can not be got liu mei,LOW
p nun nokia exploit multiple exploit types against single destination,MEDIUM
ru edi please setup message recadv for customer miratorg,MEDIUM
user still cannot access https int net nokia com,MEDIUM
fw modules will not load,MEDIUM
ee linsee application issues,LOW
cz based on pending closure notes from acces to share disk,CRITICAL
idr manager did not receive notification to approve,LOW
problem please recover for field sales manager access to sap,MEDIUM
missing application in software center unable to launch software center,MEDIUM
my virtual destop can not get network connection,LOW
hardware cannot start laptop,MEDIUM
kr delve change im address in https eur delve office com,LOW
activate user asap,CRITICAL
it please assign license to,MEDIUM
dp issue lrg issue,HIGH
my computer workstation,LOW
pfizer com logmonitor unix linux networking errors escalate and investigate issues asap unix syslog pfeunix networking errors linux,HIGH
hardware fan noise,LOW
mass changes for ru users arc team russia check,MEDIUM
rr not able to tag svo as sales item is not visible,LOW
pie gl access required,LOW
it corner concierge,LOW
request was completed but still unable to see see na deployment,LOW
unable to login into laptop,MEDIUM
no access to my,MEDIUM
hu ifsa role requested for user urgent,MEDIUM
gr assign role,MEDIUM
pl additional role sap,MEDIUM
re priority has been assigned to your group user account form approved damian reed cw otsuka us com grams credo,MEDIUM
ru hvd access issue,LOW
re credo support request for folder deletion,MEDIUM
rp nsa unix request,LOW
assign the otms training olt to karen pratzner,MEDIUM
pl vpn issue,CRITICAL
user paul dozier verizonwireless com need hws order entry access,LOW
create ad account for,CRITICAL
laptop keeps on freezing,MEDIUM
p nun nokia x force premium internal connection to host categorized as malware event type,MEDIUM
rs roles planning cockpit new production execution,MEDIUM
amer pfizer com cpqclusternode intel,HIGH
incomplete authorization on and,MEDIUM
it corner concierge,LOW
software center is empty,LOW
re zte niger unable to access niger zte ems,HIGH
unable to open hvd,MEDIUM
open a ticket alliance issue register cdr massive file,LOW
user hernan bravo claro com co getting error sso – user can not be created,LOW
bg cch contractor raluca eliu onmicrosoft com,MEDIUM
pfizer com logmonitor nfs server is not responding linux,HIGH
user needs help setting up outlook on phone,MEDIUM
cannot be deleted,MEDIUM
increase in space hellenic brand marketing,MEDIUM
hr create aw user,MEDIUM
change password page always appears when user logins to the portal j mladenov bg,LOW
security certificate expired,LOW
my computer workstation,LOW
sent job to wrong printer,MEDIUM
software fmo desk side assistance for reimaging n,LOW
re re nokia ff support support cancel po,LOW
application server is down ro alcatel lucent com,HIGH
exchange two user,CRITICAL
export tables from sap mdm data manager,MEDIUM
user unable to login steffen wiedenhoefer netcom bw de,LOW
hu unable to access a share drive,LOW
secondary account christina i got a software delivery error,LOW
user yasinozgur akgul turktelekom com tr – repeating password issue,LOW
mailbox client issue personal mailbox unable to send email to a specific user,LOW
follow up needed for em exception smarts cmdb discovery error snmp agent does not respond,MEDIUM
it corner concierge,LOW
change last name in mail,MEDIUM
re request for bonzai version upgrade,MEDIUM
it corner concierge,LOW
bpp unable to access transaction no request article related in it portal,LOW
hvd is not working properly,MEDIUM
permisstion to ccbu cchellenic com for olexii nazarenko,MEDIUM
software fmo pxe error,LOW
add users to ad group g rpa admins abcc,MEDIUM
access to hpqc audit purposes,CRITICAL
pc hardware laptop battery concerns,LOW
ro ifsa ad hoc data refresh,CRITICAL
application went missing in software center,LOW
csv autogenerated files not received after live run on sap sulo cost files,LOW
p nun nokia system device has stopped sending events offense generation,MEDIUM
ch sap role required,MEDIUM
it corner concierge,LOW
p nun nokia system device has stopped sending events offense generation,MEDIUM
retrieve webex recording,LOW
adobe acrobat pro,MEDIUM
pt open ssl ca certificate error connecting to,LOW
wintel goa servers vulnerability remediation,MEDIUM
active directory and citrix,MEDIUM
it corner concierge,LOW
some files missing when copying files from onedrive,MEDIUM
access denied on mobaxterm,LOW
ndpd siteforge issue,LOW
support portal bt users setup,LOW
idm asks for password for cimgr account in marcousis,MEDIUM
proxy error is coming up while downloading the report from web link,HIGH
issue oss windows image installation,LOW
rest api of pronto tool provides incorrect data for deadline field,MEDIUM
visio online unlicensed not activated,LOW
unable to login congo core,HIGH
please re activate volker krehut for the use of the support portal,LOW
re priority has been assigned to you data steward dl group request,MEDIUM
new blootooth mouse not working,MEDIUM
p nun nokia hacktool mimikatz detected on host,MEDIUM
issue with logging into computer,MEDIUM
software fmo pxe error,MEDIUM
p nun nokia security risk found on host,MEDIUM
emea pfizer com cpqheflttolpowersupply intel,HIGH
user sylvia signature towers com getting error sso login failed,LOW
read only issue in the var fpworkci of the host,MEDIUM
old version of bi report,MEDIUM
at name change request,MEDIUM
cannot log in to jira,LOW
see notice that i received this morning is this legitimate do i need to perform this back up thanks,MEDIUM
my computer workstation not powering on,MEDIUM
functional user lost jiradc acces privileges,MEDIUM
lost rights artifactory repositories,LOW
urgent vendor payments,LOW
re open cares ar,LOW
nagios host deletion,MEDIUM
amer pfizer com devcapacity monitor disk utilization for c exceeds devcapacity intel,MEDIUM
hardware laptop not powering on,MEDIUM
process call of smpid stuck in ndpd for indosat project,MEDIUM
hu new campari survey,MEDIUM
emea nsn net net couldn t be connected,LOW
traffica rise is down,HIGH
it corner concierge,LOW
dct tool not working,MEDIUM
outlook continues to say need password or no connection and will not retrieve or send email,LOW
change for plant,MEDIUM
switching of staging connection from otm qa to otm int env,LOW
