short_descriptions,priority
sharedrive is not working on vpn,MEDIUM
it corner concierge,LOW
wireless card is not working request for replacement,LOW
is not loading the user directory,LOW
laptop is not booting up to windows,MEDIUM
lb salesforce scrm unable to login,LOW
ee clearcase hosting application issues,MEDIUM
it corner concierge,LOW
it corner concierge,LOW
wo is stuck in processing po creation due to a missing message issue,LOW
error on laptop,MEDIUM
bso please grant access to custom report,MEDIUM
jenkins master is not working in nesc cloud kube connection,HIGH
push supplier to ariba,LOW
eija saari team e mail does not open,LOW
information browser unable to search,LOW
update customer bpm freight zone der table,MEDIUM
to update status of cr as per status in ipm,MEDIUM
it corner concierge,LOW
adobe flash player bit bit plugin failed to install in software centre,LOW
update sap as per international agreemen,LOW
add user to structural profile,MEDIUM
ad account locked,MEDIUM
pl new bins creation,MEDIUM
user bin luo meredith com correct the company name in sus,LOW
server wrongly maped with quantum,LOW
p nun nokia exploit multiple exploit types against single destination,MEDIUM
office outlook crashes,MEDIUM
ec webex event center webex recording not recieved,LOW
p nun nokia exploit multiple exploit types against single destination,MEDIUM
mda eden products not available in nct,LOW
p nun nokia single infection single host virus clean failed symantec,MEDIUM
brazil billing invoice blocked nfe,MEDIUM
operating system does not find wlan hardware on pc,LOW
it unlock user for airwatch,MEDIUM
process chain failure,LOW
hu shared mailbox access,MEDIUM
user is unable to login to nokia olcs,LOW
vpn remote access,LOW
hu ms teams request to change add owner,MEDIUM
kurt douglass otsuka us com data integrity sp request pptx,MEDIUM
access requests file share,LOW
one drive not connecting,MEDIUM
ie delete items from sap inbox,CRITICAL
data roaming service is not working,MEDIUM
unable to propose resource,LOW
grcy gm scorecard june,CRITICAL
cannot add opportunity cu to existing program for the same customer,MEDIUM
rdp oss connectivity issue,HIGH
stop jumping between travel apps tripsource is the only one you need,MEDIUM
video room conf blue jeans with polycom and ext,MEDIUM
mc nokiameetings getting account has been deactivated,LOW
gb concur change og cost center,LOW
cannot login to jira after changing my passoword,LOW
mk password reset and unlock user in erp,CRITICAL
jabber phone services jabber call option is crossed off in red and not available,LOW
it grant access to bpc to laura salaro,CRITICAL
kindly check why user has no access lucent com groups emea c cz mars,LOW
microsoft teams help,MEDIUM
italy sales rerouting,MEDIUM
parts to be transferred from avl to gpma ref part gpma ref avl,LOW
stack delete failed due to server delete,LOW
sap access for marina konovalova,MEDIUM
unable to access multi change tool,LOW
jabber phone services jabber phone services not connected,LOW
installing software docker desktop for window,LOW
not able to open outlook in my machine,MEDIUM
jabber phone services cant make calls,LOW
it corner concierge,LOW
ee jira application issues,LOW
it corner concierge,LOW
end of employment form raised by lm for employee canniot be un reserved,LOW
fnokia sap bpp webcycle unable to approve view any invoice,LOW
updating office no office programs are available outlook word excel,MEDIUM
office wlan connectivity too slow while roppongi to kawasaki,MEDIUM
drop down windows,LOW
it corner concierge,LOW
it corner concierge,LOW
please lock user urgently,MEDIUM
machine turned to black screen,LOW
user is not able to complete elearn training,MEDIUM
in jenkins delete project in bulk,LOW
incorrect dates appearing for milestones,LOW
blue screen with teams at share document jabber lost internet connection with share screen,MEDIUM
top urgent prior notification listed users will be terminated in respective,LOW
unable to launch sap bpp,LOW
microsoft office license not available,MEDIUM
user as mb tcs com unable to access cares,LOW
rapid response does not open,LOW
users not received validation response from robo,MEDIUM
nokia pc info ip address is showing overlayed on programs when user open them,LOW
ipad pro returned for lisa voight,MEDIUM
inquiries about myhrportal,LOW
wireless mouse connection,MEDIUM
re unlock sap account and reset the password,LOW
certificate validation failure,LOW
error in archive link request,LOW
jabber phone services missing softphone number in nims profile,LOW
windows v upgrade reboot loop issue after upgrading to,LOW
zot zap mat creation approver kostinbrod,MEDIUM
assignment of user in snow groups,MEDIUM
account disabled patel cw bansari,MEDIUM
soft wrap process orders picking wrongly components of sfg material noodle the noodle itself should be picked in the po during the gi backflush,LOW
can t log in to laptop,MEDIUM
re priority has been assigned to you gq edms request of assess permission,MEDIUM
it corner concierge,LOW
eg jabber – phone services phone services activation,LOW
rdnet to office connectivity,LOW
pfizer com multiple copy env daily sh pids detected escalate and investigate issues asap unix log pfizer flasharchive pfeunixflasharchiveerror unix,LOW
hardware laptop ac adapter charger,LOW
customer legal entity incorrect for tr,LOW
it corner concierge,LOW
jabber phone services phone service not working,LOW
application support portal qa access issue,LOW
it corner concierge,LOW
problem installing a software,MEDIUM
gr massive om changes deletion,MEDIUM
extra sim card,MEDIUM
ro cti user creation,MEDIUM
gpma ref avl these parts are not present while in almr are present,MEDIUM
hu help us completing an order,MEDIUM
ng double forecast transferred to snp for nigeria,CRITICAL
jabber fnokia pc phone service not working,MEDIUM
the following link is not working,LOW
request incomplete fulfillment of service request,LOW
hu bins capacity change and add new bin,MEDIUM
it corner concierge,LOW
support portal sboumendil free mobile fr access issues,LOW
reminder assign sap roles vanny imelda pzcussons com,LOW
assign role in p and q,CRITICAL
it corner concierge,LOW
subdemand areas in crm,MEDIUM
it corner concierge,LOW
software fmo windows update installs failed,LOW
web sso other concerns,LOW
zscaler authentication issues on private access,MEDIUM
it corner concierge,LOW
mc webex meeting center media contents were not visible only the audio was recorded,LOW
it corner concierge,LOW
rp nsa unix request,LOW
ma vpn login issue,LOW
mobile phone subscription how to request for change of price plan,LOW
pl vpn keeps reconnecting,LOW
my computer workstation is not starting,MEDIUM
hardware some keys are not working,LOW
remove contact details from nols agreement in cdb,LOW
password reset for bert geerts dbschenker com,LOW
p nun nokia system device has stopped sending events offense generation,MEDIUM
sap access for nikita shadevskiy,MEDIUM
i have published my power bi report but that cannot be seen by users,MEDIUM
gr access to transaction,MEDIUM
nokia container services product shows doc center as technical documentation tool,LOW
master data management mdm,MEDIUM
vpn remote access,LOW
audio driver issue,LOW
delete duplicate account for the user ibrahim bah sky uk,LOW
olcs web site access,LOW
dynamics crm license issue,LOW
network resources are not available on hvd,LOW
unable to see the files in teams,MEDIUM
mfa snow issue,LOW
zam alcatel lucent com not able to remote desktop and the application is not working,HIGH
unable to access ssdp tool,LOW
be hvd unable to connect to hvd the connection process take too long,LOW
server unable to map the network drives,LOW
office outlook application unable to receive latest emails,LOW
olcs entitlement failed,LOW
hu costa coffe update special allocation rule and cost center oog,CRITICAL
apache not running in cdb,LOW
po is not calculating tax,LOW
change wbs reviewer in coin,CRITICAL
ng request to give license,MEDIUM
partner program nikhil mahalingam al enterprise com,LOW
is inaccessible unable to login via rdc or citrix,HIGH
p nun nokia single infection single host virus clean failed symantec,MEDIUM
p nun nokia authentication repeat windows login failures,MEDIUM
sap issue with the os “narrower label” sap codes can t add them to the contract and thus create the source list,LOW
p nun nokia recon aggressive local scanner detected,MEDIUM
application support portal name and email are not replicated after hours,LOW
it corner concierge,LOW
pfizer com down solaris zone,LOW
hardware integrated laptop keyboard is not working or some keys are not working,MEDIUM
jabber other message could not be delivered error seen even when online in jabber,MEDIUM
gr registered users report,CRITICAL
mailbox meeting scheduling option in outlook is not visible,MEDIUM
subrata halder cw otsuka us com subrata halder cw otsuka us com wants to access ar material,MEDIUM
p nun nokia proactive recurrent reinfection,MEDIUM
it corner concierge,LOW
server date is incorrect c p fad,HIGH
it corner concierge,LOW
jabber input keyword here user unable to make calls on jabber client,LOW
netwrix auditor inactive users in active directory report mocr otsuka com,MEDIUM
important problems with skype,MEDIUM
fi software fmo remote desktop connection issue,LOW
machine is making noise and unable to click on any icon on taskbar,LOW
vpc request to increase the memory space,LOW
orange france maxwell issue when creating users,LOW
mobile mail additional security issue,LOW
re priority has been assigned to you fw otsuka sharepoint,MEDIUM
software installation failed,LOW
fnokia voice mobile requesting for the puk code advised user to visit atem but is missing,LOW
it please assign the users ito,MEDIUM
downloading in software center stucked on,LOW
software related laptop issue cause lost multiple files,MEDIUM
mailbox client issue,LOW
nsn logo on ngit reporting sharepoint,LOW
dn s not reached to otm prod from sap,HIGH
nsn intra network account,MEDIUM
it corner concierge,LOW
overdue task deadline extension,CRITICAL
duplicate sim activation request,LOW
fg bom not generate requiremen,MEDIUM
urgent employees same country germany same calendar not blocked for,MEDIUM
slowness observed in sql server,HIGH
support portal you do not acess to this service error on ipm tab,LOW
ukraine material master language key uk not populated for new materials created,LOW
jabber phone services i can t make calls on jabber,LOW
outlook not opening,MEDIUM
pfizer com logmonitor scsi errors escalate and investigate issues asap unix syslog pfeunix scsi errors linux,LOW
pl block sender,MEDIUM
the user is calling stating that they need an active directory account unlock,MEDIUM
westford usa network connectivity issues,HIGH
unable to access to https access nokiasiemensnetworks com isource svnroot pev lsp blrpet server,LOW
excessive hcp s in territory,MEDIUM
nis server not responding for domain cb ndp,LOW
please blacklist helge hovland apply no as phishing email,CRITICAL
hr sap user access,MEDIUM
vpn remote access,LOW
fw user sanggaard cw kirsten citrix problem still having issues with credo,MEDIUM
emea pfizer com cpqheflttolpowersupply intel,LOW
hp network printer toner cartridge replacement,LOW
concur email address changed,LOW
rp nsa unix request,LOW
new user creation nataliya ivanova,MEDIUM
network password reset,MEDIUM
getting error while creating a new work group request,LOW
i ext high five gitlab developer gms members not replicated to eedir,LOW
po catalog for egypt,LOW
hcp has not detail products,MEDIUM
it corner concierge,LOW
fw grasp notification issue,MEDIUM
is overfilled by eemon processes,LOW
hardware battery faulty,LOW
shedule and start jobs for copa revaluation,CRITICAL
sap application ccr monitoring not in active im,LOW
ng access to shared mailbox nbc horeca cchellenic com,MEDIUM
pl add planon roles,MEDIUM
support portal unable to login,LOW
vpn remote access,MEDIUM
due to re org from opdc to oapi po was transferred to po please remove approval workflow for business approval attached,HIGH
p nun nokia system device has stopped sending events offense generation,MEDIUM
jabber phone service issue,LOW
no internet connection,MEDIUM
it corner concierge,LOW
shutoff nostate after the weekend,MEDIUM
period closing in ecr for has not y,LOW
problem running matlab compiled executables in hwee grid environment,LOW
no authorization to enter site forge,LOW
crm q access,MEDIUM
demand management tool invalid access url,LOW
fcw support required covid,MEDIUM
hardware in replacing laptop charger request,LOW
skype meetings report requested,MEDIUM
jabber ru jabber phone services not connected,LOW
bitlocker recovery key issue,MEDIUM
user access roles,CRITICAL
snmpagent pfizer com notresponding intel,LOW
pfizer com down solaris zone,HIGH
puuemasecva emea pfizer com down intel,HIGH
at assign leo plan profile,MEDIUM
skype for business emojis are not being displayed,MEDIUM
gpma access query,LOW
nokia pc in sleep mode every minutes,LOW
it corner concierge,LOW
version synch issue between jira projects,LOW
software center shows empty,LOW
ipad set up,MEDIUM
bitlocker drive recovery key request,MEDIUM
cdb prod execute failed,LOW
r d development virtual machine frozen,LOW
sign in issue,MEDIUM
bpms portal access,MEDIUM
webex meeting center auto account creation failed,LOW
pl citrix issue on ipad reg,CRITICAL
citrix login issue,LOW
ph bitlocker recovery key prompt ref local it assistance required,LOW
bitlocker recovery manage your pin was missing,MEDIUM
pdm staged mass emails,LOW
rfc pgs argentina planned power outage on pompeya mtr,LOW
assign new group to user in snow,MEDIUM
p nun nokia exploit multiple exploit types against single destination,MEDIUM
sso appears again and again,LOW
getting sso error when signing on support portal https customer nokia com support s,LOW
pc termination owner information cannot be found in nokia it portal,LOW
p nun nokia soar security risk found on host,MEDIUM
it corner concierge,LOW
p nun nokia proactive recurrent reinfection,MEDIUM
it corner concierge,LOW
enable on shared drive,LOW
r studio not working in server,HIGH
pl access to,MEDIUM
priority gxs alcatel gxs proactive monit dcts a qtc ordrsp message failure to comcast moderate,LOW
project not visible after creation,MEDIUM
microsoft visio pro en not available on software center,LOW
am no ping reply,HIGH
cryptex password request,MEDIUM
cid supplier table has data load error,LOW
pfizer com logmonitor filesystem or device errors escalate and investigate issues asap unix syslog pfeunix full filesystem errors linux,HIGH
customer user cannot access to helpdesk silvan,LOW
p nun nokia exploit multiple exploit types against single destination,MEDIUM
it corner concierge,LOW
atem tool application issues,LOW
credo internet issue upload and download speeds fluctuating,MEDIUM
it corner concierge,LOW
valid svo not available,LOW
ro software multiple sw issues,MEDIUM
unable to open software center,LOW
hosted virtual desktop cannot launch or start hvd,LOW
general otsuka main page,MEDIUM
nokiameetings error user authentication failed reason user account has been deactivated,LOW
vpn remote access missing gateways in anyconnect,LOW
nokia sharepoint sites all can not be reached,HIGH
in webex unable to share screen,LOW
hr request for training administration authorizations in helo,MEDIUM
obseleted user data,LOW
receiving proxy error in,MEDIUM
user is not able to access jiradc ext net nokia com,LOW
dp issue backup failure for,HIGH
exchange two user,CRITICAL
email address not updated for supplier in i buy although changed in sbm,LOW
sg unable to access lab pc,LOW
it corner concierge,LOW
there will be a planned power outage on the nokia area at the aalborg site alfred nobels vej,HIGH
ap staging vlanpak by,MEDIUM
pfizer com down linux,HIGH
blocked billing document release error,LOW
installing software access to jira permissions issue,LOW
analysis for excel issue,LOW
not in active im for,LOW
ncib bangalore production instance not working properly,MEDIUM
standard user account reset password,LOW
request for access rights to ee casn tools for new member lasse kiviluoto,LOW
software center application list is empty missing not opening,LOW
hr assign ad role,MEDIUM
it corner concierge,LOW
sap access for chandra fractal,MEDIUM
sharepoint document is missing a link,MEDIUM
it corner concierge,LOW
cares login id disabled issue,MEDIUM
user samirmahesh wadhwani sce com – repeating password issue,LOW
p nun nokia source trying to visit malicious domain,MEDIUM
plannon user creation,CRITICAL
hardware screen of the pc has been broken,MEDIUM
onedrive backup questions,MEDIUM
need assistance in mapping shared drives in computer,MEDIUM
fw your account has been used to make purchases in itunes,MEDIUM
update to release code,CRITICAL
office outlook not responding,MEDIUM
microsoft active directory account unlock,MEDIUM
iam itim template for update optional role for legacy role zc xx ar posting xxxx,MEDIUM
software fmo unable to install pc,LOW
data sync issue in ad cmdb,MEDIUM
vpn connection keeps on reconnecting,LOW
p nun nokia security risk found on host,MEDIUM
network slowness when accessing artifacts on artifactory ext net nokia com,LOW
n the security database on the server does not have a computer account for this workstation trust relationship,MEDIUM
p nun nokia soar security risk found on host,MEDIUM
it corner concierge,LOW
pl retain previous e mail address,MEDIUM
unable to start hvd,LOW
edge chromium pdf reader disable,LOW
lawson unable to login to,LOW
node in server farm unresponsive,LOW
new doors user authentcation,LOW
order for material in is not flown to ecp,LOW
office language pack language pack installation ru for office,LOW
specs completed in engineering applications site are not showing up in the mesa application,MEDIUM
nokia employee not in ldap,LOW
additional roles for,MEDIUM
cannot access destination ips after connected to maintenance gateway,MEDIUM
it corner concierge,LOW
activate ord for utenos prekyba,MEDIUM
error at the power up,LOW
user facing issue with information security program,MEDIUM
c drive almost full error,LOW
outlook other request to remove the calendar meeting notification,LOW
unable to access gerrit url http ext net nokia com,LOW
fnokia software installation of steelray project viewer from software catalog fails,MEDIUM
jabber nl user status not visible on jabber,LOW
in onenote i am not able to remove several secions secion groups it keeps comming back,LOW
p nun nokia soar security risk found on host,MEDIUM
portal password reset,MEDIUM
cy sap access,MEDIUM
terminate the laptop,LOW
be unable to access fn weekly repost test,MEDIUM
ee collaborator application issues,LOW
exchange two user,CRITICAL
jabber phone unable to connect to jabber phone services,LOW
c z cz sk abp load into fsr report,MEDIUM
fnokia aip microsoft azure information protection bar is missing after an update,LOW
issue with login,MEDIUM
issue elf june,MEDIUM
slowness observed in bo production,LOW
update variants kosovo,MEDIUM
jabber phone services jabber phone services not connected,LOW
wcs build servers can t be accessed,LOW
defect smp custom field project id doesn t work correctly,HIGH
it corner concierge,LOW
server unable to access,LOW
issue with traffic to server in us from europe,LOW
netwrix auditor inactive users in active directory report mocr otsuka com,MEDIUM
it corner concierge,LOW
oriom sandbox o drive mapping,MEDIUM
christine vreeland otsuka us com oracle discoverer error,MEDIUM
it creation survey,CRITICAL
emea pfizer com cpqtapestatuschange intel,LOW
request access for acos forge,MEDIUM
workday company code,MEDIUM
adobe printing issues on personal hp printer,MEDIUM
jabber phone services don´t work,LOW
amer pfizer com down intel,LOW
sap logon pad in citrix is not responding,LOW
kangitpanos labs ca alcatel lucent com server does not respond,MEDIUM
can t log into laptop,MEDIUM
hardware mouse pad not working even when using external mouse,LOW
sap running slow,HIGH
user intl att com – repeating password issue,LOW
invalid username or password was specified,MEDIUM
ht ac su energy wh,LOW
rs roles planning cockpit new production execution,MEDIUM
software fmo task secquence error,LOW
jabber phone services configuration error,LOW
pfizer com logmonitor memory errors escalate and investigate issues asap unix syslog pfeunix memory errors linux,LOW
vpn unable to reinstall,LOW
ng full mailbox,CRITICAL
urgent messaging status shows net standard orders pending,LOW
pop up error message,LOW
hardware laptop charger not working,MEDIUM
it corner concierge,LOW
hanged in read function in mail box,HIGH
ccr monitoring manufacturing order production version is lock for,LOW
listed users need to be corrected in sp back end,LOW
unable to schedule create webex meetings via outlook,MEDIUM
it corner concierge,LOW
aspire server error in application loading error,MEDIUM
unable to access support portal,LOW
password reset shahbaz cw mohammad,MEDIUM
p nun nokia proactive recurrent reinfection,MEDIUM
too many concurrent connections max allowed,MEDIUM
it corner concierge,LOW
treatnow eligibility kamali swaminathan,MEDIUM
it corner concierge,LOW
vpc blank screen,LOW
it corner concierge,LOW
pfizer com process the xntpd process has stopped escalate asap solaris zone,HIGH
when trying to take the skype call getting an error that skype headsets are not working,MEDIUM
can log into doors,LOW
my computer workstation,LOW
no teams meeting icon in outlook,MEDIUM
anyconnect vpn connection keeps on reconnecting your ticket has been solved,LOW
p nun nokia system device has stopped sending events offense generation,MEDIUM
posting issue in backend,LOW
it corner concierge,LOW
rsa configuration assistance in laptop,LOW
erm time entries while submitting throws error,MEDIUM
edit pop up with html,MEDIUM
stop auto posting cc,MEDIUM
p nun nokia authentication repeat windows login failures,MEDIUM
one page pro installation,MEDIUM
proxy settings not working on chrome and ie,LOW
ecomex q test environment taxes issue,LOW
hu pc network issue on pc with lan and wifi,LOW
project and portfolio management,MEDIUM
git commit error,MEDIUM
java error in matlab,LOW
nira submitted not being received,LOW
test access for,CRITICAL
password reset knape cw sabine,MEDIUM
ruth killeen account,LOW
it corner concierge,LOW
cares registration error cares registration record is incomplete,LOW
nsnamlglobal report provides incorrect results,LOW
repost released consensus plan to bps for austria,CRITICAL
domain join issue,LOW
ritm notification does not show approval group name,MEDIUM
mobile reception issue,MEDIUM
vpn remote access,LOW
it add users to ad group g cchbc co bso,MEDIUM
workstation bluetooth driver missing,MEDIUM
bso archive mails for mbo team nigeria ar ng cchellenic com,MEDIUM
skipped approval from marketing eur ns,LOW
pl move aplication and all profiles,CRITICAL
lan cable installation,LOW
jabber other jabber voice doesn t work with the sip password,LOW
not able to access persistent europe,LOW
single sign on salesforce critical update,LOW
appears to be offline rfc starting soon,MEDIUM
ivory coast revision missing for part code,LOW
nesc instance in account https hz dc os rdn eecloud nsn rdnet net instance seems like it is shutting down,LOW
provide high level text of the issue,LOW
new roles for user,MEDIUM
cz deleting request for transportation,MEDIUM
at please upload targets for sla,MEDIUM
hardware hard disk installation,LOW
svo code not able to tag the demand,LOW
it corner concierge,LOW
outlook instant search,LOW
it corner concierge,LOW
new otm account,LOW
failed in an lsf library call bad user id,MEDIUM
insite portal access,MEDIUM
screen front cover broken,LOW
p nun nokia x force premium internal connection to host categorized as malware event type,MEDIUM
p nun nokia authentication repeat non windows and non wireless login failures,MEDIUM
sccm software not received,LOW
request incomplete fulfillment of service request,MEDIUM
not able to continue where you left off in elearn course when you click resume,MEDIUM
issue with contract availability for case handling,LOW
ro enable online archive,MEDIUM
error message when packing deliveries in sap bpp,CRITICAL
user having issues with activex controls in edge chromium,LOW
jinal shah cw otsuka us com shah cw jinal wants to access global pharmacovigilance,MEDIUM
application support portal can not login to support portal,LOW
firewall blocking email address,MEDIUM
cz add license g license,CRITICAL
duplicated allocation for user anthirvo,LOW
unable to install windows,MEDIUM
install local printer,MEDIUM
unable to see vpc icon upon logging in it was crashing,LOW
blue planet erp demande de maj de ship to sur sharepoint,LOW
cab ecr enh transaction,LOW
p nun nokia proactive recurrent reinfection,MEDIUM
software fmo performance issue freezes everytime,MEDIUM
brazil ecomex tool update for,LOW
bot got terminated due to exception further investigation required,MEDIUM
execute dashboard edp download fail leap reporting affected,HIGH
re user addition in group snow,HIGH
sp act not working for users,LOW
issue can not log in with single sign on info at internal job market,LOW
po the sdm confirmed the modification of email but not visible in i buy,LOW
node monitor problem,MEDIUM
unable to login,MEDIUM
rsa asking for device password,LOW
fw fw notification contract worker record modification incident,MEDIUM
p nun nokia hacktool mimikatz detected on host symantec detection,HIGH
signature in acrobat,MEDIUM
snmpagent hospira corp notresponding intel,LOW
software fmo black screen machine keeps restarting automatically,LOW
not able to logon to password tool and change the password,LOW
active directory and citrix,MEDIUM
totw it guidelines for remote working during coronavirus outbreak,LOW
ng configuration update,MEDIUM
files has been stuck in bpp,LOW
cannot access bi data in bwp,LOW
hp printing can t log on any printer to copy or to scan a document,LOW
hvd can t start outlook on hvd,MEDIUM
